{
  "schemaVersion": 1,
  "schema": "https://aura-knowledge.github.io/schemas/garden-queries.schema.json",
  "site": "https://aura-knowledge.github.io",
  "base": "",
  "generatedAt": "2026-06-18T00:00:00.000Z",
  "catalogSize": {
    "queryCount": 6,
    "totalResults": 56
  },
  "dimensions": [
    {
      "name": "topic",
      "description": "Article topic.",
      "values": [
        "agent-provenance",
        "agentic-commerce",
        "ai-native-publishing",
        "consumer-behavior",
        "digital-gardens",
        "incumbent-adjacent-ventures",
        "open-protocols",
        "product-truth",
        "research-workflows"
      ]
    },
    {
      "name": "tag",
      "description": "Article tag.",
      "values": [
        "ai-agents",
        "commerce",
        "consumer-behavior",
        "digital-gardens",
        "open-protocols",
        "product-truth",
        "publishing",
        "research-workflows"
      ]
    },
    {
      "name": "maturity",
      "description": "Article maturity.",
      "values": [
        "seed",
        "sprout",
        "evergreen",
        "contested",
        "superseded"
      ]
    },
    {
      "name": "status",
      "description": "Article publication status.",
      "values": [
        "draft",
        "review",
        "published",
        "archived"
      ]
    },
    {
      "name": "citesSourceType",
      "description": "Source type cited by the article.",
      "values": [
        "design",
        "documentation",
        "industry-report",
        "product",
        "protocol",
        "regulatory",
        "regulatory-data",
        "research",
        "schema",
        "standard"
      ]
    },
    {
      "name": "claimState",
      "description": "Computed verification state of a claim.",
      "values": [
        "verified",
        "contested",
        "stale",
        "needs-evidence",
        "missing-counterevidence",
        "draft"
      ]
    },
    {
      "name": "keyword",
      "description": "Case-insensitive phrase match across title, summary, thesis, claims, sources, tags, and topics."
    },
    {
      "name": "relatedTo",
      "description": "Articles related by shared topic or graph edge to the given slug."
    }
  ],
  "queries": [
    {
      "name": "articles-by-topic",
      "description": "Published articles grouped by topic.",
      "params": {
        "groupBy": "topic"
      },
      "resultType": "articles",
      "resultCount": 9,
      "results": [
        {
          "articleId": "article:agent-auditable-research",
          "slug": "agent-auditable-research",
          "articleUrl": "https://aura-knowledge.github.io/articles/agent-auditable-research/",
          "agentJsonPath": "/agents/articles/agent-auditable-research.json",
          "topic": "agent-provenance"
        },
        {
          "articleId": "article:agentic-commerce-product-truth",
          "slug": "agentic-commerce-product-truth",
          "articleUrl": "https://aura-knowledge.github.io/articles/agentic-commerce-product-truth/",
          "agentJsonPath": "/agents/articles/agentic-commerce-product-truth.json",
          "topic": "agentic-commerce"
        },
        {
          "articleId": "article:agent-auditable-research",
          "slug": "agent-auditable-research",
          "articleUrl": "https://aura-knowledge.github.io/articles/agent-auditable-research/",
          "agentJsonPath": "/agents/articles/agent-auditable-research.json",
          "topic": "ai-native-publishing"
        },
        {
          "articleId": "article:agentic-commerce-product-truth",
          "slug": "agentic-commerce-product-truth",
          "articleUrl": "https://aura-knowledge.github.io/articles/agentic-commerce-product-truth/",
          "agentJsonPath": "/agents/articles/agentic-commerce-product-truth.json",
          "topic": "consumer-behavior"
        },
        {
          "articleId": "article:agent-auditable-research",
          "slug": "agent-auditable-research",
          "articleUrl": "https://aura-knowledge.github.io/articles/agent-auditable-research/",
          "agentJsonPath": "/agents/articles/agent-auditable-research.json",
          "topic": "digital-gardens"
        },
        {
          "articleId": "article:agentic-commerce-product-truth",
          "slug": "agentic-commerce-product-truth",
          "articleUrl": "https://aura-knowledge.github.io/articles/agentic-commerce-product-truth/",
          "agentJsonPath": "/agents/articles/agentic-commerce-product-truth.json",
          "topic": "incumbent-adjacent-ventures"
        },
        {
          "articleId": "article:agentic-commerce-product-truth",
          "slug": "agentic-commerce-product-truth",
          "articleUrl": "https://aura-knowledge.github.io/articles/agentic-commerce-product-truth/",
          "agentJsonPath": "/agents/articles/agentic-commerce-product-truth.json",
          "topic": "open-protocols"
        },
        {
          "articleId": "article:agentic-commerce-product-truth",
          "slug": "agentic-commerce-product-truth",
          "articleUrl": "https://aura-knowledge.github.io/articles/agentic-commerce-product-truth/",
          "agentJsonPath": "/agents/articles/agentic-commerce-product-truth.json",
          "topic": "product-truth"
        },
        {
          "articleId": "article:agent-auditable-research",
          "slug": "agent-auditable-research",
          "articleUrl": "https://aura-knowledge.github.io/articles/agent-auditable-research/",
          "agentJsonPath": "/agents/articles/agent-auditable-research.json",
          "topic": "research-workflows"
        }
      ]
    },
    {
      "name": "claims-needing-evidence",
      "description": "Claims whose computed verification state is needs-evidence.",
      "params": {
        "claimState": "needs-evidence"
      },
      "resultType": "claims",
      "resultCount": 0,
      "results": []
    },
    {
      "name": "claims-contested-or-stale",
      "description": "Claims whose computed verification state is contested or stale.",
      "params": {
        "claimState": [
          "contested",
          "stale"
        ]
      },
      "resultType": "claims",
      "resultCount": 0,
      "results": []
    },
    {
      "name": "high-confidence-claims",
      "description": "Claims with confidence high.",
      "params": {
        "confidence": "high"
      },
      "resultType": "claims",
      "resultCount": 2,
      "results": [
        {
          "articleId": "article:agent-auditable-research",
          "slug": "agent-auditable-research",
          "articleUrl": "https://aura-knowledge.github.io/articles/agent-auditable-research/",
          "agentJsonPath": "/agents/articles/agent-auditable-research.json",
          "claimId": "claim-001",
          "claim": "Polished prose is becoming cheap; inspectable reasoning is becoming scarce.",
          "confidence": "high",
          "status": "core"
        },
        {
          "articleId": "article:agent-auditable-research",
          "slug": "agent-auditable-research",
          "articleUrl": "https://aura-knowledge.github.io/articles/agent-auditable-research/",
          "agentJsonPath": "/agents/articles/agent-auditable-research.json",
          "claimId": "claim-005",
          "claim": "AI assistance should be disclosed while the human remains accountable for thesis, source selection, wording, and conclusions.",
          "confidence": "high",
          "status": "normative"
        }
      ]
    },
    {
      "name": "sources-by-type",
      "description": "Sources grouped by source type.",
      "params": {
        "groupBy": "sourceType"
      },
      "resultType": "sources",
      "resultCount": 43,
      "results": [
        {
          "articleId": "article:agent-auditable-research",
          "slug": "agent-auditable-research",
          "articleUrl": "https://aura-knowledge.github.io/articles/agent-auditable-research/",
          "agentJsonPath": "/agents/articles/agent-auditable-research.json",
          "sourceId": "source-digital-gardens-appleton",
          "sourceTitle": "A Brief History & Ethos of the Digital Garden",
          "sourceType": "design",
          "sourceUrl": "https://maggieappleton.com/nontechnical-gardening"
        },
        {
          "articleId": "article:agent-auditable-research",
          "slug": "agent-auditable-research",
          "articleUrl": "https://aura-knowledge.github.io/articles/agent-auditable-research/",
          "agentJsonPath": "/agents/articles/agent-auditable-research.json",
          "sourceId": "source-digital-gardens-qu",
          "sourceTitle": "Digital Gardens",
          "sourceType": "design",
          "sourceUrl": "https://vivqu.com/blog/2020/10/18/digital-gardens/"
        },
        {
          "articleId": "article:agent-auditable-research",
          "slug": "agent-auditable-research",
          "articleUrl": "https://aura-knowledge.github.io/articles/agent-auditable-research/",
          "agentJsonPath": "/agents/articles/agent-auditable-research.json",
          "sourceId": "source-nng-cognitive-load",
          "sourceTitle": "4 Principles for Reducing Cognitive Load in Forms",
          "sourceType": "design",
          "sourceUrl": "https://www.nngroup.com/articles/4-principles-reduce-cognitive-load/"
        },
        {
          "articleId": "article:agentic-commerce-product-truth",
          "slug": "agentic-commerce-product-truth",
          "articleUrl": "https://aura-knowledge.github.io/articles/agentic-commerce-product-truth/",
          "agentJsonPath": "/agents/articles/agentic-commerce-product-truth.json",
          "sourceId": "source-google-product-structured-data",
          "sourceTitle": "Product snippet structured data",
          "sourceType": "documentation",
          "sourceUrl": "https://developers.google.com/search/docs/appearance/structured-data/product-snippet"
        },
        {